{
 "schema_version": 1,
 "contract": 1,
 "revision": 2,
 "counts": {
  "stores": {
   "value": 5,
   "src": "facts/entrypoints.json#data_access (targets) + facts/domain.json#data_table",
   "unit": "count"
  },
  "tables": {
   "value": 3,
   "src": "facts/entrypoints.json#data_access (targets) + facts/domain.json#data_table (kind table)",
   "unit": "count"
  },
  "endpoints": {
   "value": 8,
   "src": "facts/entrypoints.json#data_access (method and path, or operation and table)",
   "unit": "count"
  },
  "writers": {
   "value": 6,
   "src": "facts/entrypoints.json#data_access[operation is a write].location.path (distinct modules)",
   "unit": "count"
  },
  "readers": {
   "value": 2,
   "src": "facts/entrypoints.json#data_access[operation is a read].location.path (distinct modules)",
   "unit": "count"
  },
  "write_paths": {
   "value": 7,
   "src": "facts/entrypoints.json#data_access[operation is a write].location.path (distinct modules) (call sites)",
   "unit": "count"
  },
  "attributes": {
   "value": 9,
   "src": "facts/entrypoints.json#data_access.value.keys (object literal the call sends; names only) (distinct store and key)",
   "unit": "count"
  },
  "multi_writer_endpoints": {
   "value": 1,
   "src": "violations[kind=endpoint]",
   "unit": "count"
  },
  "multi_writer_tables": {
   "value": 1,
   "src": "violations[kind=table]",
   "unit": "count"
  },
  "gaps": {
   "value": 21,
   "src": "paths[].steps[state=gap] (count)",
   "unit": "count"
  },
  "single_in_target": {
   "value": 2,
   "src": "target-architecture.json#current_components[].target_component: stores written from one target component",
   "unit": "count"
  }
 },
 "tiers": [
  {
   "id": "field",
   "state": "not_measured",
   "known": {
    "value": 0,
    "src": "paths[].steps.field.state in known, direct",
    "unit": "count"
   },
   "gaps": [
    {
     "reason": "no_ui_extractor",
     "paths": 7,
     "step": "NS40.T2"
    }
   ]
  },
  {
   "id": "form",
   "state": "not_measured",
   "known": {
    "value": 0,
    "src": "paths[].steps.form.state in known, direct",
    "unit": "count"
   },
   "gaps": [
    {
     "reason": "no_ui_extractor",
     "paths": 7,
     "step": "NS40.T2"
    }
   ]
  },
  {
   "id": "key",
   "state": "partial",
   "known": {
    "value": 6,
    "src": "paths[].steps.key.state in known, direct",
    "unit": "count"
   },
   "gaps": [
    {
     "reason": "payload_not_literal",
     "paths": 1,
     "step": "NS40.T2"
    }
   ]
  },
  {
   "id": "caller",
   "state": "measured",
   "known": {
    "value": 7,
    "src": "paths[].steps.caller.state in known, direct",
    "unit": "count"
   },
   "gaps": []
  },
  {
   "id": "endpoint",
   "state": "measured",
   "known": {
    "value": 7,
    "src": "paths[].steps.endpoint.state in known, direct",
    "unit": "count"
   },
   "gaps": []
  },
  {
   "id": "handler",
   "state": "partial",
   "known": {
    "value": 4,
    "src": "paths[].steps.handler.state in known, direct",
    "unit": "count"
   },
   "gaps": [
    {
     "reason": "no_matching_route",
     "paths": 3,
     "step": "NS40.T1"
    }
   ]
  },
  {
   "id": "column",
   "state": "partial",
   "known": {
    "value": 4,
    "src": "paths[].steps.column.state in known, direct",
    "unit": "count"
   },
   "gaps": [
    {
     "reason": "behind_handler",
     "paths": 3,
     "step": "NS40.T2"
    }
   ]
  }
 ],
 "stores": [
  {
   "id": "api:/notes",
   "kind": "resource",
   "name": "/notes",
   "client": "http",
   "declared": null,
   "endpoints": [
    "ep:POST /notes"
   ],
   "sites": 1,
   "writers": [
    "web/src/lib/notesApi.ts"
   ],
   "readers": [],
   "multi_writer": false,
   "today": {
    "writers": 1,
    "components": [
     "web/src/lib"
    ]
   },
   "target": {
    "components": [
     "api-client"
    ],
    "single": true,
    "unmapped": []
   },
   "change": "single_already"
  },
  {
   "id": "api:/orders",
   "kind": "resource",
   "name": "/orders",
   "client": "http",
   "declared": null,
   "endpoints": [
    "ep:POST /orders",
    "ep:PUT /orders/{}",
    "ep:GET /orders"
   ],
   "sites": 4,
   "writers": [
    "web/src/lib/ordersApi.ts",
    "web/src/pages/Checkout.tsx"
   ],
   "readers": [
    "web/src/lib/ordersApi.ts"
   ],
   "multi_writer": true,
   "today": {
    "writers": 2,
    "components": [
     "web/src/lib",
     "web/src/pages"
    ]
   },
   "target": {
    "components": [
     "api-client",
     "features"
    ],
    "single": false,
    "unmapped": []
   },
   "change": "still_multiple"
  },
  {
   "id": "table:audit_log",
   "kind": "table",
   "name": "audit_log",
   "client": null,
   "declared": {
    "path": "db/schema.sql",
    "line": 9,
    "fact": "FACT-T-2",
    "rls": false
   },
   "endpoints": [],
   "sites": 0,
   "writers": [],
   "readers": [],
   "multi_writer": false,
   "today": {
    "writers": 0,
    "components": []
   },
   "target": {
    "components": [],
    "single": null,
    "unmapped": []
   },
   "change": null
  },
  {
   "id": "table:orders",
   "kind": "table",
   "name": "orders",
   "client": "supabase",
   "declared": null,
   "endpoints": [
    "ep:supabase:insert orders"
   ],
   "sites": 1,
   "writers": [
    "server/orders.ts"
   ],
   "readers": [],
   "multi_writer": false,
   "today": {
    "writers": 1,
    "components": [
     "server"
    ]
   },
   "target": {
    "components": [
     "routes"
    ],
    "single": true,
    "unmapped": []
   },
   "change": "single_already"
  },
  {
   "id": "table:stock",
   "kind": "table",
   "name": "stock",
   "client": "supabase",
   "declared": {
    "path": "db/schema.sql",
    "line": 1,
    "fact": "FACT-T-1",
    "rls": true
   },
   "endpoints": [
    "ep:supabase:update stock",
    "ep:supabase:insert stock",
    "ep:supabase:select stock"
   ],
   "sites": 3,
   "writers": [
    "web/src/lib/stock.ts",
    "web/src/pages/Admin.tsx"
   ],
   "readers": [
    "web/src/pages/Admin.tsx"
   ],
   "multi_writer": true,
   "today": {
    "writers": 2,
    "components": [
     "web/src/lib",
     "web/src/pages"
    ]
   },
   "target": {
    "components": [
     "api-client",
     "features"
    ],
    "single": false,
    "unmapped": []
   },
   "change": "still_multiple"
  }
 ],
 "endpoints": [
  {
   "id": "ep:GET /orders",
   "label": "GET /orders",
   "store": "api:/orders",
   "operation": "get",
   "method": "GET",
   "writers": [],
   "readers": [
    "web/src/lib/ordersApi.ts"
   ],
   "keys": null,
   "sites": [
    {
     "path": "web/src/lib/ordersApi.ts",
     "line": 14,
     "fact": "FACT-DA-4"
    }
   ],
   "multi_writer": false
  },
  {
   "id": "ep:POST /notes",
   "label": "POST /notes",
   "store": "api:/notes",
   "operation": "post",
   "method": "POST",
   "writers": [
    "web/src/lib/notesApi.ts"
   ],
   "readers": [],
   "keys": [
    "text"
   ],
   "sites": [
    {
     "path": "web/src/lib/notesApi.ts",
     "line": 15,
     "fact": "FACT-DA-5"
    }
   ],
   "multi_writer": false
  },
  {
   "id": "ep:POST /orders",
   "label": "POST /orders",
   "store": "api:/orders",
   "operation": "post",
   "method": "POST",
   "writers": [
    "web/src/lib/ordersApi.ts",
    "web/src/pages/Checkout.tsx"
   ],
   "readers": [],
   "keys": [
    "coupon",
    "item",
    "qty"
   ],
   "sites": [
    {
     "path": "web/src/lib/ordersApi.ts",
     "line": 11,
     "fact": "FACT-DA-1"
    },
    {
     "path": "web/src/pages/Checkout.tsx",
     "line": 12,
     "fact": "FACT-DA-2"
    }
   ],
   "multi_writer": true
  },
  {
   "id": "ep:PUT /orders/{}",
   "label": "PUT /orders/{}",
   "store": "api:/orders",
   "operation": "put",
   "method": "PUT",
   "writers": [
    "web/src/lib/ordersApi.ts"
   ],
   "readers": [],
   "keys": null,
   "sites": [
    {
     "path": "web/src/lib/ordersApi.ts",
     "line": 13,
     "fact": "FACT-DA-3"
    }
   ],
   "multi_writer": false
  },
  {
   "id": "ep:supabase:insert orders",
   "label": "insert orders",
   "store": "table:orders",
   "operation": "insert",
   "method": null,
   "writers": [
    "server/orders.ts"
   ],
   "readers": [],
   "keys": [
    "item",
    "qty",
    "user_id"
   ],
   "sites": [
    {
     "path": "server/orders.ts",
     "line": 19,
     "fact": "FACT-DA-9"
    }
   ],
   "multi_writer": false
  },
  {
   "id": "ep:supabase:insert stock",
   "label": "insert stock",
   "store": "table:stock",
   "operation": "insert",
   "method": null,
   "writers": [
    "web/src/pages/Admin.tsx"
   ],
   "readers": [],
   "keys": [
    "count",
    "sku"
   ],
   "sites": [
    {
     "path": "web/src/pages/Admin.tsx",
     "line": 17,
     "fact": "FACT-DA-7"
    }
   ],
   "multi_writer": false
  },
  {
   "id": "ep:supabase:select stock",
   "label": "select stock",
   "store": "table:stock",
   "operation": "select",
   "method": null,
   "writers": [],
   "readers": [
    "web/src/pages/Admin.tsx"
   ],
   "keys": null,
   "sites": [
    {
     "path": "web/src/pages/Admin.tsx",
     "line": 18,
     "fact": "FACT-DA-8"
    }
   ],
   "multi_writer": false
  },
  {
   "id": "ep:supabase:update stock",
   "label": "update stock",
   "store": "table:stock",
   "operation": "update",
   "method": null,
   "writers": [
    "web/src/lib/stock.ts"
   ],
   "readers": [],
   "keys": [
    "count"
   ],
   "sites": [
    {
     "path": "web/src/lib/stock.ts",
     "line": 16,
     "fact": "FACT-DA-6"
    }
   ],
   "multi_writer": false
  }
 ],
 "paths": [
  {
   "store": "table:orders",
   "endpoint": "ep:supabase:insert orders",
   "site": {
    "path": "server/orders.ts",
    "line": 19,
    "fact": "FACT-DA-9"
   },
   "steps": {
    "field": {
     "state": "gap",
     "reason": "no_ui_extractor"
    },
    "form": {
     "state": "gap",
     "reason": "no_ui_extractor"
    },
    "key": {
     "state": "known",
     "keys": [
      "item",
      "qty",
      "user_id"
     ],
     "partial": false
    },
    "caller": {
     "state": "known",